id,category,promess,fulfillment,,verification_doc_name_1,Título del proyecto,verification_doc_link_1,1° trámite,Veto,Insistencia,2°-3° trámite,Comisión Mixta,Tribunal Constitucional,Aprobación Presidencial,Promulgado,"Rechazado
/Retirado",Avance,Simple,Suma,Inmediata,Totales,Esfuerzo,Marginal,Parcial,Total,Coherencia,description
1,Agricultura,"Enviaremos al Congreso un proyecto de ley que contenga el Estatuto del Temporero y la Actividad Agrícola de Temporada, que consagre protección a estos trabajadores y trabajadoras.",0.00%,,,,,,,,,,,,,,0,,,,0,0,,,,0,
2,Agricultura,"En el Gobierno anterior, enviamos el proyecto de Ley de Obtentores Vegetales, conocida como “Ley Monsanto”(...) Hemos conocido nuevos antecedentes y presenciado un debate sobre si esa ley es pertinente y cuáles pueden ser sus riesgos. Vamos a revisar ese proyecto de ley, escuchando todas las opiniones, salvaguardando y respetando la soberanía alimentaria y las semillas tradicionales",0.00%,,,,,,,,,,,,,,0,,,,0,0,,,,0,
3,Agricultura,También deben potenciarse las capacidades técnicas y de fiscalización del Servicio Agrícola y Ganadero (SAG).,100.00%,,9690-01,Asignaciones y modificaciones a la planta del Servicio Agrícola y Ganadero.,http://congresoabierto.cl/proyectos/9690-01,,,,,,,,1,,1,,3,,3,0.0714285714,,,1,1,"Se crean  asignaciones de estímulo para el personal del SAG, nuevos cargos, bonos extraordinarios y un plan institucional anual y rendición de cuentas de éste"
4,Agricultura,"Formaremos en la Oficina de Estudios y Políticas Agrarias (ODEPA) un equipo de desarrollo de institucionalidad, regulación y normas de libre competencia que permita revisar las normativas de comercio de tal manera de impedir la operación de formas de comercio en la agroindustria o en el sector forestal que atentan contra los consumidores o los productores.",0.00%,,,,,,,,,,,,,,0,,,,0,0,,,,0,
5,Agricultura,"En materia forestal, enviaremos al Congreso un proyecto de ley que prorrogue por dos años los incentivos a la forestación, junto con legislar para eliminar las barreras de entrada que han limitado la incorporación de pequeños y medianos propietarios forestales a los beneficios de la actual legislación sobre bosque nativo.",0.00%,,,,,,,,,,,,,,0,,,,0,0,,,,0,
6,Agua,"Debemos mejorar la gestión del agua para riego eficiente. Potenciaremos las políticas de mejoramientos de canales, pozos profundos y de riego técnificado. Para esto se realizarán los cambios legales y se destinarán los recursos necesarios.",0.00%,,,,,,,,,,,,,,0,,,,0,0,,,,0,
7,Agua,Avanzaremos en una normativa que haga posible la existencia de la figura recursos hídricos con fines sociales. Estos usos serán prioritarios y establecerán restricciones al ejercicio de todos los demás usos con fines competitivos.,45.00%,,7543-12,Reforma el Código de Aguas,http://congresoabierto.cl/proyectos/7543-12,1,,,,,,,,,0.45,,,,0,0,,,1,1,"El proyecto contempla que se permita a la Administración limitar el ejercicio de los derechos de aprovechamiento en función del interés público, ya sea reduciéndolos temporalmente o redistribuyendo las aguas y establece el consumo humano y el saneamiento como usos prioritarios del agua, los que siempre prevalecerán en el otorgamiento como en la limitación del ejercicio del derecho de aprovechamiento"
8,Agua,También modificaremos la normativa para redefinir la utilización de los acuíferos sobre-otorgados de acuerdo al uso efectivo de los derechos.,45.00%,,7543-12,Reforma el Código de Aguas,http://congresoabierto.cl/proyectos/7543-12,1,,,,,,,,,0.45,,,,0,0,,,1,1,"Se establece que las concesiones caducarán por el solo ministerio de la ley si no se hace un uso efectivo del recurso en un plazo de cuatro o de ocho años, según tengan el carácter de derechos consuntivos o no consuntivos."
9,Agua,"Adicionalmente, estableceremos la normativa que permita el intercambio de derechos provisionales y eventuales por aquella proporción no utilizada de los derechos. En el caso de acuíferos con baja recarga pero con gran volumen almacenado, definiremos volúmenes de agua que se pueden extraer en plazos determinados sin generar efectos ambientales adversos.",0.00%,,,,,,,,,,,,,,0,,,,0,0,,,,0,
10,Cultura,"Pondremos en marcha una nueva política nacional de museos, que les permita financiarse y mejorar su gestión y contenidos que ofrecen a la ciudadanía.",0.00%,,,,,,,,,,,,,,0,,,,0,0,,,,0,
11,Cultura,"Adicionalmente, desarrollaremos una política sobre cultura digital, que nos permita aprovechar de mejor manera el desarrollo tecnológico, para, por una parte, ampliar las posibilidades para las políticas públicas de fomento a la creación cultural y, por la otra, democratizar, promover y facilitar, de mejor manera, el acceso a bienes culturales por parte de la ciudadanía.",0.00%,,,,,,,,,,,,,,0,,,,0,0,,,,0,
12,Cultura,"En los primeros 100 días de Gobierno enviaremos al Congreso un proyecto de ley que crea el Ministerio de Cultura y Patrimonio, que será una institución con énfasis locales, que promueva la cultura, las artes y la interculturalidad, para lo cual, presentaremos un proyecto de ley al Congreso.",0.00%,,,,,,,,,,,,,,0,,,,0,0,,,,0,
13,Cultura,"Implementaremos políticas públicas que permitan asegurar una adecuada protección y circulación de la producción audiovisual, musical, así como del libro.",0.00%,,,,,,,,,,,,,,0,,,,0,0,,,,0,
14,Cultura,"Introduciremos modificaciones al Consejo Nacional de Televisión, incorporándolo al Ministerio de Cultura y Patrimonio, ampliando sus atribuciones, manteniendo su rol de regulador de la TV, enfatizando su rol de fomento de la calidad de la industria televisiva, tanto a nivel de TV abierta, pago, regional y comunitaria.",0.00%,,,,,,,,,,,,,,0,,,,0,0,,,,0,
15,Cultura,"Enviaremos un proyecto de ley al Congreso para realizar un conjunto de modificaciones en materia de televisión pública. Se deben ampliar las facultades de TVN para un cumplimiento efectivo de los objetivos asociados con la misión pública que la ley le entrega. Al directorio se le aplicarán los deberes y régimen de responsabilidades de los directores de las Sociedades Anónimas y se debe imponer la obligación al Directorio del canal público de dar cuenta de su gestión una vez al año. TVN, debe incorporar financiamiento público de manera sistemática, con el objeto de que pueda producir bienes públicos socialmente valorados que los privados no tienen obligación de producir.",0.00%,,,,,,,,,,,,,,0,,,,0,0,,,,0,
16,Cultura,Perfeccionaremos la legislación y fiscalización del cumplimiento de los derechos laborales aplicables a los distintos sectores de la cultura.,0.00%,,,,,,,,,,,,,,0,,,,0,0,,,,0,
17,Defensa,"En el ámbito doméstico nuestro objetivo fundamental será retomar con ímpetu las reformas institucionales para el desarrollo de una Defensa Nacional mejor preparada para las tareas que le entregue la autoridad civil, logrando ser más transparente, y más eficiente y eficaz. En este sentido, se considera necesario el fortalecimiento del mando del Jefe del Estado Mayor Conjunto en lo relativo a su empleo en tiempos de paz incluso en instancias tales como la preparación, prevención y reacción ante emergencias, así como de su responsabilidad social.",0.00%,,,,,,,,,,,,,,0,,,,0,0,,,,0,
18,Defensa,"De esta forma se enviará una indicación sustitutiva al Congreso Nacional respecto del proyecto de ley que deroga la ley reservada del cobre en la que se establezca que la asignación de los recursos para el financiamiento de la Defensa Nacional se realizará mediante la formulación de una planificación presupuestaria cuatrienal, que contemple el financiamiento de los programas y proyectos de inversión y los gastos de operación y mantenimiento de equipamiento.",0.00%,,,,,,,,,,,,,,0,,,,0,0,,,,0,
19,Defensa,"Reformaremos la competencia de la Justicia Militar, de manera tal que las causas con civiles víctimas de delitos cometidos por militares y carabineros sean conocidas por tribunales ordinarios. Se avanzará desde el actual modelo de fuero militar hacia uno nuevo caracterizado por la igualdad de las garantías procesales entre ciudadanos civiles y uniformados, con una judicatura letrada y plenamente independiente de la estructura de mando militar.",0.00%,,,,,,,,,,,,,,0,,,,0,0,,,,0,
20,Defensa,"Concluiremos la modernización de la carrera militar, terminando con las distorsiones previsionales.",0.00%,,,,,,,,,,,,,,0,,,,0,0,,,,0,
21,Democracia,Impulsaremos la sustitución del actual sistema electoral binominal para la elección parlamentaria por uno de representación proporcional.,94.90%,,9326-07,Sustituye el sistema electoral binominal por uno de carácter proporcional inclusivo y fortalece la representatividad del Congreso Nacional,http://congresoabierto.cl/proyectos/9326-07,,,,,,,1,,,0.9,4,11,4,19,0.4904761905,,,1,1,Se reemplaza el sistema electoral binominal por uno proporcional moderado.
22,Democracia,"De esta manera, basada en una fuerte convicción democrática, se recoge la demanda nacional por una Nueva Constitución Política para Chile a impulsar en un proceso democrático, institucional y participativo que permita alcanzar este propósito.",0.00%,,,,,,,,,,,,,,0,,,,0,0,,,,0,
23,Democracia,Impulsaremos la creación de la Defensoría del Pueblo u Ombudsman.,0.00%,,,,,,,,,,,,,,0,,,,0,0,,,,0,
24,Democracia,"En el plano político, nuestra convicción es que cada región debe elegir a las autoridades que representan mejor los anhelos, sueños y proyectos de la comunidad. Si hoy se eligen alcaldes, parlamentarios y Consejeros Regionales, ese mecanismo debe extenderse a la máxima autoridad regional, hoy su intendente o intendenta.",45.00%,,9834-06,Dispone la elección popular del órgano ejecutivo del gobierno regional.,http://congresoabierto.cl/proyectos/9834-06,1,,,,,,,,,0.45,,,,0,0,,,1,1,Pretende modificar la constitución estableciendo que el cargo de Intendente se elige por votación popular y dura 4 años con posibilidad de reelección inmediata
25,Democracia,"Crearemos una División de Participación Ciudadana en la SEGEGOB, de tal manera de dar adecuado seguimiento y control del cumplimiento de metas ministeriales en materias de participación.",0.00%,,,,,,,,,,,,,,0,,,,0,0,,,,0,
26,Democracia,"Nos comprometemos a impulsar la tramitación, hasta su aprobación, de un proyecto de ley que otorgue el derecho a voto de chilenos en el extranjero.",100.00%,,9069-07,Regula el ejercicio del sufragio de los ciudadanos que se encuentran fuera del país.,http://congresoabierto.cl/proyectos/9069-07,,,,,,,,1,,1,,2,,2,0.0476190476,,,1,1,
27,Derechos Humanos,"Reconoceremos con el máximo valor en la Constitución, los tratados y convenciones internacionales sobre derechos humanos y, en especial, incorporaremos una norma que establezca que, en toda interpretación constitucional o legal, deben primar dichos tratados o convenciones.",25.12%,,9748-07,"Modifica la Constitución Política de la República para establecer que los crímenes y delitos de guerra, lesa humanidad y genocidio no puedan prescribir ni ser amnistiados.",http://congresoabierto.cl/proyectos/9748-07,1,,,,,,,,,0.45,,2,,2,0.0476190476,,1,,0.5,"El proyecto incorpora un nuevo inciso final al numeral 3° del artículo 19 de la Constitución, que establece que los crímenes y delitos que conforme al derecho nacional o internacional sean calificables de genocidio, lesa humanidad o guerra, no serán susceptibles de amnistía o prescripción –total o parcial- , con independencia de la fecha en que ellas se hubieren cometido, adaptando con ello la legislación chilena a las exigencias del Derecho Internacional sobre la materia. Sin embargo no señala nada sobre la interpretación de las normas de acuerdo a los tratados internacionales"
28,Derechos Humanos,"Impulsaremos medidas legislativas y administrativas que impidan la impunidad en materia de DDHH, tales como impedir toda aplicación en los juicios sobre Crímenes de Lesa Humanidad del D.L. N°2.191, de Amnistía de 1978, y de las normas que regulan la prescripción en materia de delitos comunes o de la prescripción en materia de responsabilidades civiles.",59.95%,47.62%,9773-07,"Adecua la ley penal en materia de amnistía, indulto y prescripción de la acción penal y la pena a lo que dispone el derecho internacional respecto de los delitos de genocidio, de lesa humanidad o de guerra.",http://congresoabierto.cl/proyectos/9773-07,1,,,,,,,,,0.45,,2,,2,0.0476190476,,,1,1,"Establece que los crímenes y delitos de guerra, lesa humanidad y genocidio, cualquiera sea la fecha en que se hayan cometido, son imprescritpibles e inamnistiables, como también que no se podrá conceder indulto o cualquier otro beneficio alternativo que implique la reducción o sustitución de las condenas privativas de libertad a los autores de estos crímenes y delitos. "
28,,,,73.29%,6422 -07,Establece ley interpretativa que adecua la legislación penal chilena a los tratados internacionales en materia de derechos humanos,http://congresoabierto.cl/proyectos/6422-07,,,,1,,,,,,0.66,,9,,9,0.2142857143,,,1,1,"Establece que no se podrán aplicar las normas sobre amnistía o prescripción cuando según las reglas del derecho internacional se refiera a hechos que configuren delitos de genocidio o crímenes de lesa humanidad o de guerra, así como la inaplicabilidad de la denominada prescripción gradual de la pena o media prescripción."
28,,,,66.81%,1265-10,"Aprueba la Convención sobre Imprescriptibilidad de los Crímenes de Guerra y de los Crímenes de Lesa Humanidad, adoptada por la Asamblea General de las Naciones Unidas, mediante la resolución Nº 2391 (XXIII), del 26 de Noviembre de 1968",http://congresoabierto.cl/proyectos/1265-10,,,,1,,,,,,0.66,,1,,1,0.0238095238,,,1,1,"Califica a los crímenes de guerra y de lesa humanidad entre los delitos de derecho internacional más graves y expresa el principio de la imprescriptibilidad de estos crímenes y, asimismo, asegura su aplicación universal."
28,,,,52.07%,4162-07,"Proyecto de ley que declara la nulidad del Decreto Ley N° 2.191, de 1978.",http://congresoabierto.cl/proyectos/4162-07,1,,,,,,,,,0.45,1,5,,6,0.1285714286,,,1,1,"Declara nulo el DL de amnistía y establece que son imprescritibles e inamnistiables los delitos calificados como crímenes de guerra o crímenes de lesa humanidad, de conformidad a los Tratados Internacionales ratificados por Chile y que se encuentran vigentes, así como por los Principios Generales del Derecho Internacional."
29,Derechos Humanos,"Crearemos la Subsecretaría de Derechos Humanos en el Ministerio de Justicia y Derechos Humanos, con dotación de recursos humanos y presupuestarios que permitan el trabajo de coordinación y ejecución en materia de derechos humanos.",73.29%,,8207-07,Crea la Subsecretaría de Derechos Humanos y establece adecuaciones en la Ley Orgánica del Ministerio de Justicia,http://congresoabierto.cl/proyectos/8207-07,,,,1,,,,,,0.66,,7,1,8,0.2142857143,,,1,1,El proyecto crea la Subsecretaría de Derechos Humanos dentro del Ministerio de Justicia
30,Derechos Humanos,"Adoptaremos medidas, legislativas si fueren necesarias, para reconocer el derecho de las víctimas de las graves violaciones a los derechos humanos y sus familiares, a obtener reparaciones civiles de los victimarios y, en su caso, del Estado. Revisaremos las actuales leyes reparatorias.",6.75%,,9593-17,"Consagra el deber de los órganos del Estado de individualizar, como víctimas de desaparición forzada, a las personas detenidas desaparecidas que figuran en los informes que indica",http://congresoabierto.cl/proyectos/9593-17,1,,,,,,,,,0.45,,,,0,0,1,,,0.15,Establece que todos los órganos del Estado deberán velar por que los registros que estén a su cargo reconozcan y expresen como víctimas de desaparición forzada a las personas detenidas desaparecidas cuyos nombres aparecen incluidos en los informes de las comisiones creadas en la búsqueda de verdad y justicia y que dichos registros deberán actualizarse dentro de un año. No menciona la posibilidad de obtener reparaciones civiles
31,Derechos Humanos,"Asignaremos a una entidad estatal permanente que se haga cargo del reconocimiento, acogida, asistencia jurídica, social y de reparación para las víctimas de Crímenes de la Dictadura.",0.00%,,,,,,,,,,,,,,0,,,,0,0,,,,0,
32,Derechos Humanos,"Adicionalmente, desarrollaremos una iniciativa legal para regular el derecho a reunión y revisaremos los reglamentos, protocolos y práctica de las Fuerzas Policiales para su adecuación a estándares internacionales.",0.00%,,,,,,,,,,,,,,0,,,,0,0,,,,0,
33,Descentralización,Nuestro compromiso es dotar al gobierno regional de autonomía política y administrativa especialmente en las materias relacionadas con el desarrollo y competitividad del territorio.,66.00%,,7963-06,Relativo al fortalecimiento de la regionalización del país.,http://congresoabierto.cl/proyectos/7963-06,,,,1,,,,1,,0.66,,,,0,0,,,1,1,"La indicación sustitutiva del Gobierno establece un procedimiento para transferir competencias del Gobierno central a los regionales  en ordenamiento territorial, fomento de las actividades productivas y desarrollo social y cultural."
34,Descentralización,"Para apoyar este proceso, la Subsecretaría de Desarrollo Regional (SUBDERE) contará con mandato especial. Estableceremos en la SUBDERE una unidad especializada de descentralización, la que impulsará, coordinará y evaluará el proceso de descentralización y transferencia de facultades y competencias a regiones, así como el traspaso de Servicios Públicos, proceso que será paulatino y por grupos de regiones.",0.00%,,,,,,,,,,,,,,0,,,,0,0,,,,0,
35,Descentralización,"Se deberán realizar los cambios normativos necesarios para establecer las condiciones que permitan que los Gobiernos Regionales tengan relaciones más estrechas de cooperación con las Municipalidades de la Región para el cumplimiento de objetivos comunes o complementarios, incluyendo presupuestos de inversión.",0.00%,,,,,,,,,,,,,,0,,,,0,0,,,,0,
36,Descentralización,"Adicionalmente, realizaremos las modificaciones tendientes a mejorar los mecanismos de participación, transparencia y control ciudadano regional.",0.00%,,,,,,,,,,,,,,0,,,,0,0,,,,0,
37,Descentralización,"Por otra parte, resulta fundamental que cada región cuente con un sistema de estadísticas que permita registrar el comportamiento en todos los ámbitos de intervención de los gobiernos regionales y posibilite el establecimiento de líneas base, información para el diseño, seguimiento y evaluación de políticas y programas, y para establecer los indicadores que permitan objetividad en las rendiciones de cuentas.",0.00%,,,,,,,,,,,,,,0,,,,0,0,,,,0,
38,Descentralización,"En la misma línea, extenderemos el Sistema de Alta Dirección Pública a cargos regionales, con el consecuente atractivo de remuneraciones.",0.00%,,,,,,,,,,,,,,0,,,,0,0,,,,0,
39,Discapacidad,"Establecer la institucionalidad pública será una prioridad. Crearemos la Subsecretaría de la Discapacidad, que impulsará de manera transversal el tema, teniendo como eje la integración y necesidades de las personas con discapacidad y sus familias.",0.00%,,,,,,,,,,,,,,0,,,,0,0,,,,0,
40,Discapacidad,"Incorporaremos al arancel de FONASA y a la cobertura de seguros privados, las prestaciones de Terapeutas Ocupacionales.",0.00%,,,,,,,,,,,,,,0,,,,0,0,,,,0,
41,Discapacidad,"Además, estudiaremos la regulación de la condición de preexistencia en los seguros de salud cuando las personas con discapacidad dejan de ser carga o son contratadas y deben cotizar directamente, a fin de evitar la pérdida de beneficios de su programa de salud previo.",0.00%,,,,,,,,,,,,,,0,,,,0,0,,,,0,
42,Economía y Comercio,"El Consejo Nacional de Innovación para la Competitividad (CNIC) (...) contarán con un nuevo estatus legal, que les permita estabilidad, junto con ampliar su ámbito de preocupación desde la competitividad al desarrollo nacional, manteniendo el énfasis en los temas de la investigación científica, el desarrollo tecnológico, la innovación y el emprendimiento, tanto en su dimensión productiva como social.",0.00%,,,,,,,,,,,,,,0,,,,0,0,,,,0,
43,Economía y Comercio,"El Fondo de Innovación para la Competitividad (FIC) (...) contarán con un nuevo estatus legal, que les permita estabilidad, junto con ampliar su ámbito de preocupación desde la competitividad al desarrollo nacional, manteniendo el énfasis en los temas de la investigación científica, el desarrollo tecnológico, la innovación y el emprendimiento, tanto en su dimensión productiva como social.",0.00%,,,,,,,,,,,,,,0,,,,0,0,,,,0,
44,Economía y Comercio,"En el ámbito institucional, fortaleceremos al Ministro de Economía en su rol de autoridad responsable en el campo de la innovación y el desarrollo productivo, creando la Subsecretaría de Ciencia, Tecnología e Innovación.",0.00%,,,,,,,,,,,,,,0,,,,0,0,,,,0,
45,Economía y Comercio,En los primeros 100 días de Gobierno se enviará al Congreso el Proyecto de Ley de Reforma Tributaria.,100.00%,,9290-05,Reforma tributaria que modifica el sistema de tributación de la renta e introduce diversos ajustes en el sistema tributario. ,http://congresoabierto.cl/proyectos/9290-05,,,,,,,,1,,1,6,1,,7,0.080952381,,,1,1,"Se ingresa una reforma tributaria con 4 grandes objetivos: aumentar la carga tributaria para financiar, con ingresos permanentes, los gastos permanentes de la reforma educacional; avanzar en equidad tributaria, mejorando la distribución del ingreso; introducir nuevos y más eficientes mecanismos de incentivos al ahorro e inversión, y avanzar en medidas que disminuyan la evasión y la elusión."
46,Economía y Comercio,"En los primeros 100 días de Gobierno, enviaremos al Congreso el proyecto de ley del fortalecimiento del SERNAC, que permitirá que tenga atribuciones reales y efectivas para defender los derechos de los consumidores.",52.86%,,9369-03,"Modifica ley N° 19.496, sobre Protección de los Derechos de los Consumidores. ",http://congresoabierto.cl/proyectos/9369-03,1,,,,,,,,,0.45,,6,,6,0.1428571429,,,1,1,El proyecto fortalece al Sernac y le otorga mayores facultades de fiscalización y de sanción en materia de derechos de los consumidores
47,Economía y Comercio,"Revisaremos la regulación de los juicios colectivos, para asegurar un procedimiento eficiente que procure soluciones adecuadas,",31.67%,,9369-03,"Modifica ley N° 19.496, sobre Protección de los Derechos de los Consumidores. ",http://congresoabierto.cl/proyectos/9369-03,1,,,,,,,,,0.45,,7,,7,0.1666666667,,1,,0.5,"El proyecto se preserva y perfecciona la facultad del SERNAC de llevar a cabo mediaciones colectivas con anterioridad al ejercicio de las acciones judiciales, regulando su procedencia, su plazo de duración, su publicidad a fin de que los consumidores afectados o las Asociaciones de Consumidores puedan efectuar observaciones y sugerir ajustes en las soluciones propuestas, y sus efectos en el caso en que se arribe a un acuerdo que solucione el conflicto. Sin embargo no hay modificaciones a los procesos de juicios colectivos."
48,Economía y Comercio,"Mejorar las normas y estándares para impulsar la innovación, proponiendo un programa que incluya: i) mayores recursos para el SERNAC, para generar información pública que permita evaluar la calidad de los productos y servicios ofrecidos",0.00%,,,,,,,,,,,,,,0,,,,,0,,,,0,
49,Economía y Comercio,"Dotaremos al SERNAC de facultades para fiscalizar, multar, interpretar la ley y dictar normativas, proveyendo de criterios claros de cumplimiento legal con efecto general. Junto a ello, fortaleceremos la institucionalidad y los recursos humanos destinados a la fiscalización y la defensa contra los abusos.",54.17%,,9369-03,"Modifica ley N° 19.496, sobre Protección de los Derechos de los Consumidores. ",http://congresoabierto.cl/proyectos/9369-03,1,,,,,,,,,0.45,,7,,,0.1666666667,,,1,1,"Se establece la facultad del SERNAC de fiscalizar, sancionar, interpretar la ley y dictar normas de carácter general y se contempla un fortalecimiento de los recursos humanos."
50,Economía y Comercio,"Estableceremos un procedimiento administrativo ante el SERNAC, que reemplace la competencia general de los Juzgados de Policía Local para conocer materias de consumo individuales, y que podrá culminar con la aplicación de multas, entre otras sanciones, y la orden de reintegros.",54.17%,,9369-03,"Modifica ley N° 19.496, sobre Protección de los Derechos de los Consumidores. ",http://congresoabierto.cl/proyectos/9369-03,1,,,,,,,,,0.45,,7,,,0.1666666667,,,1,1,El proyecto reemplaza la competencia de los Juzgados de Policía Local para resolver las infracciones e indemnizaciones en materia de conflictos de interés individual. Las denuncias por infracciones serán resueltas por el SERNAC. En tanto que las acciones de indemnización de perjuicios serán resueltas por los Tribunales Ordinarios de Justicia
51,Economía y Comercio,"Eliminar las restricciones legales que establece que las Asociaciones (de Consumidores) sólo pueden realizar actividades lucrativas para la recuperación de sus costos y como contrapartida, incrementar las obligaciones de transparencia de su financiamiento y exigir normas de contabilidad regulatoria.",54.17%,,9369-03,"Modifica ley N° 19.496, sobre Protección de los Derechos de los Consumidores. ",http://congresoabierto.cl/proyectos/9369-03,1,,,,,,,,,0.45,,7,,,0.1666666667,,,1,1,"Se contempla la posibilidad de que ejecuten y celebren actos y contratos civiles y mercantiles para cumplir sus objetivos, y destinen los frutos de dichos actos y contratos al financiamiento de sus actividades propias. Además, estarán sometidas a reglas especiales sobre financiamiento, contabilidad y transparencia."
