id,category,promess,fulfillment,,verification_doc_name_1,Título del proyecto,verification_doc_link_1,1° trámite,Veto,Insistencia,2°-3° trámite,Comisión Mixta,Tribunal Constitucional,Aprobación Presidencial,Promulgado,"Rechazado
/Retirado",Avance,Simple,Suma,Inmediata,Totales,Esfuerzo,Marginal,Parcial,Total,Coherencia,description
109,Justicia,"En el ámbito del Derecho Penal, impulsaremos una revisión integral de la legislación penal vigente, sin perjuicio de lo cual nos haremos cargo de reformas urgentes, especialmente en el ámbito de los delitos económicos, frente a la premisa de superar el paradigma de una legislación anclada en una visión clasista y estereotipada de la delincuencia. La sanción penal de la colusión constituye un claro ejemplo en esa línea.",0.00%,,,,,,,,,,,,,,0,,,,0,0,,,,0,
110,Justicia,"Especializaremos todos los órganos de la justicia penal de adolescentes (policía, jueces, fiscales y defensores), mediante su capacitación y formación profesional, la creación por ley de incentivos de carrera para la dedicación exclusiva o preferente, y la orientación de metas e indicadores hacia el favorecimiento del proceso de reinserción y el respeto de los derechos y garantías de los adolescentes.",15.00%,,9529-07,"Modifica la ley N° 19.718, que crea la Defensoría Penal Pública, con el objeto de crear cargos para la defensa penal especializada en adolescentes.",http://congresoabierto.cl/proyectos/9529-07,,,,,,,,1,,1,,9,,9,0.2142857143,1,,,0.15,"El proyecto permite la provisión de defensa penal especializada de adolescentes, no obstante no hace referencia a la modificación del sistema judicial, de fiscales y de policía"
111,Medio Ambiente,"En materia de fortalecimiento institucional, es necesario evaluar el Sistema de Evaluación de Impacto Ambiental (SEIA,) a la luz de los objetivos iniciales que nos movieron a presentar la reforma a la institucionalidad ambiental en nuestro Gobierno, e impulsaremos con decisión los cambios necesarios que aseguren a todos los ciudadanos, organizaciones y empresarios, una institucionalidad validada desde el punto de vista técnico.",0.00%,,,,,,,,,,,,,,0,,,,0,0,,,,0,
112,Medio Ambiente,"Estableceremos los mecanismos institucionales y recursos para la entrega efectiva de orientación, mediación y defensa ambiental ciudadana, que facilite la solución de problemas ambientales locales.",0.00%,,,,,,,,,,,,,,0,,,,0,0,,,,0,
112,Medio Ambiente,"Completaremos la reforma ambiental iniciada en el período 2006-2010 (...) tramitando el proyecto de ley que crea el Servicio de Biodiversidad y Áreas Protegidas, que definirá las categorías de protección y establecerá los rangos de prohibiciones y limitaciones de actividades para cada una de ellas, fortaleciendo la protección de la biodiversidad, que no sólo se restringe a las áreas protegidas.",52.33%,,9404-12,Crea el Servicio de Biodiversidad y Áreas Protegidas y el Sistema Nacional de Áreas Protegidas.,http://congresoabierto.cl/proyectos/9404-12,1,,,,,,,,,0.45,9,,1,10,0.1333333333,,,1,1,"El proyecto crea el Servicio de Biodiversidad y Áreas Protegidas con funciones tales como administrar el Sistema Nacional de Áreas Protegidas y elaborar y ejecutar estudios y programas de investigación, conducentes a conocer el estado de la biodiversidad, entre otras."
113,Medio Ambiente,Estudiaremos una solución al estatuto jurídico que debe tener CONAF.,0.00%,,,,,,,,,,,,,,0,,,,0,0,,,,0,
114,Medio Ambiente,"Sobre residuos, daremos prioridad a proponer y tramitar una ley general de residuos. No soluciona el tema la normativa parcial y dispersa que tenemos hoy. Requerimos una ley integral. Buscaremos eliminar las barreras que hoy existen para que se puedan aplicar las mejores tecnologías disponibles y ya probadas en el mundo.",43.47%,35.91%,7908 -15,Sanciona el transporte de desechos hacia vertederos clandestinos,http://congresoabierto.cl/proyectos/7908-15,,,,1,,,,,,0.66,9,,,9,0.0857142857,,1,,0.5,"Sanciona el transporte de deshechos hacia vertederos clandestinos, pero no constituye una ley integral en materia de deshechos"
115,,,,51.02%,9094-12,Establece marco para la gestión de residuos y responsabilidad extendida del productor,http://congresoabierto.cl/proyectos/9094-12,1,,,,,,,,,0.45,4,3,,7,0.1095238095,,,1,1,"El objetivo del proyecto incentivar la prevención en la generación de residuos y fomentar su reutilización, reciclaje y otro tipo de valorización, a fin de proteger la salud de las personas y el medio ambiente."
116,Minería,"La institucionalidad del Estado en el sector minero requiere una modernización para enfrentar el desarrollo del sector. Fortaleceremos al Ministerio de Minería, en especial en recursos humanos y personal técnico calificado.",0.00%,,,,,,,,,,,,,,0,,,,0,0,,,,0,
117,Minería,"Ante el incremento de la inversión estatal en proyectos mineros, fortaleceremos a COCHILCO con mayores atribuciones para cumplir a cabalidad su rol de resguardo de los intereses del Estado en sus empresas mineras, por medio de la fiscalización y evaluación de inversiones y contratos.",0.00%,,,,,,,,,,,,,,0,,,,0,0,,,,0,
118,Minería,"Adicionalmente, realizaremos un fortalecimiento institucional del SERNAGEOMIN para que desarrolle su labor de control de la seguridad en las faenas mineras.",18.00%,,9624-08,"Modifica la ley N° 20.551, que Regula el Cierre de Faenas e Instalaciones Mineras, y el decreto ley N° 3.525, de 1980, que crea el Sernageomin.",http://congresoabierto.cl/proyectos/9624-08,,,,1,,,,,,0.66,,10,,10,0.2380952381,1,,,0.15,El proyecto perfecciona la forma de cálculo de la vida útil de los proyectos mineros y en relación al SERNAGEOMIN lo faculta para exigir la entrega de información geológica básica de carácter general y establece sanción de multa en caso de incumplimiento. No hay más normas relativas al fortalecimiento de dicho Servicio.
119,Minería,"Además, revalorizaremos el rol de la Empresa Nacional de Minería (ENAMI) (...). Su actual estructura corporativa le dificulta mostrar eficiencia en su función, por lo que estableceremos un gobierno corporativo moderno.",0.00%,,,,,,,,,,,,,,0,,,,0,0,,,,0,
120,Minería,"Estudiaremos y aplicaremos nuevas normas para el perfeccionamiento del sistema de concesiones mineras, de forma que este fomente la exploración y no se constituya en una potencial barrera a la entrada de nuevos actores.",0.00%,,,,,,,,,,,,,,0,,,,0,0,,,,0,
121,Modernización del Estado,"Avanzaremos en la profesionalización de las dirigencias deportivas, con mayores exigencias de control y transparencia en el manejo de recursos.",0.00%,,,,,,,,,,,,,,0,,,,0,0,,,,0,
122,Modernización del Estado,"Crearemos la Agencia de Concesiones, con personalidad jurídica propia, competencias y atribuciones. Esta agencia asesorará a los distintos ministerios, servicios y municipalidades que requieran ejecutar proyectos mediante el mecanismo de concesiones.",0.00%,,,,,,,,,,,,,,0,,,,0,0,,,,0,
123,Modernización del Estado,"Para ello crearemos la Dirección Nacional de Evaluación, que tendrá la misión de contribuir al mejoramiento continuo de la calidad de las políticas, programas y proyectos públicos, a través de la incorporación de procesos de evaluación que asesoren la toma de decisiones.",0.00%,,,,,,,,,,,,,,0,,,,0,0,,,,0,
124,Modernización del Estado,"Para ello, evaluaremos la institucionalización de la negociación colectiva en el sector público, estudiando mecanismos que se hagan cargo de sus especiales particularidades.",0.00%,,,,,,,,,,,,,,0,,,,0,0,,,,0,
125,Modernización del Estado,"Perfeccionamiento del Sistema de Alta Dirección Pública. A 10 años de su creación, el Sistema de Alta Dirección Pública ha confirmado su relevancia entre las reformas del Estado que se han implementado en nuestro país. Ha sido exitoso al implantar un exigente sistema de selección de altos directivos. Sin embargo, al producirse el cambio de gobierno en 2010 mostró debilidad, convirtiendo la facultad para despedir a los altos directivos en un mecanismo de remoción política. Por lo tanto, es indispensable incorporar mejoras al sistema;",0.00%,,,,,,,,,,,,,,0,,,,0,0,,,,0,
126,Modernización del Estado,"Implementaremos un sistema de fideicomiso ciego para las nuevas autoridades, sin esperar la aprobación del proyecto de ley que se discute actualmente en el Congreso, y el cual fortaleceremos y aceleraremos.",66.97%,,7616-06,Probidad en la Función Pública,http://congresoabierto.cl/proyectos/7616-06,,,,1,,,,,,0.66,3,,,3,0.0285714286,,,1,1,Se presentan indicaciones al Proyecto de Ley de Probidad en la Función Pública para perfeccionar el sistema de fideicomiso ciego
127,Modernización del Estado,Además profundizaremos la normativa que regula el conflicto de interés en las funciones posteriores al ejercicio de cargos públicos.,0.00%,,,,,,,,,,,,,,0,,,,0,0,,,,0,
128,Modernización del Estado,Perfeccionaremos las declaraciones de patrimonio e intereses de las autoridades públicas a fin de que constituyan efectivamente un mecanismo de transparencia y fiscalización ciudadana.,66.97%,,7616-06,Probidad en la Función Pública,http://congresoabierto.cl/proyectos/7616-06,,,,1,,,,,,0.66,3,,,3,0.0285714286,,,1,1,Se presentan indicaciones al Proyecto de Ley de Probidad en la Función Pública para perfeccionar el sistema de declaraciones de intereses y patrimonio
129,Modernización del Estado,"Vamos a perfeccionar el marco institucional de las empresas del Estado y de aquellas en que éste tenga participación, fortaleciendo sus gobiernos corporativos, para que estas empresas logren aumentar su transparencia y capacidad estratégica, mejorando la calidad de la gestión y la supervisión de las mismas.",0.00%,,,,,,,,,,,,,,0,,,,0,0,,,,0,
130,Modernización del Estado,"Para lograr lo anterior perfeccionaremos el proyecto de ley que moderniza el INE, haciendo un verdadero esfuerzo en términos de su fortalecimiento institucional.",0.00%,,,,,,,,,,,,,,0,,,,0,0,,,,0,
131,Modernización del Estado,"Para el cumplimiento de los objetivos señalados, se debe instaurar una nueva diplomacia que exige una Cancillería moderna, con flexibilidad y capacidad de respuesta a los desafíos del siglo XXI, contando con un personal especializado y una carrera funcionaria basada en capacidades y mérito, acompañada de un diseño y visión estratégica que genere el ya mencionado Sistema Nacional de Política Exterior.",0.00%,,,,,,,,,,,,,,0,,,,0,0,,,,0,
132,Municipios,"En materia Institucional, el objetivo estratégico es que los municipios pasen de cumplir una función exclusivamente de administración, a la constitución de verdaderos Gobiernos Locales, ampliando las actuales funciones que desarrollan y entregándoles un mayor grado de autonomía en la gestión. Esto es posible, mediante el traspaso de competencias, recursos propios, autonomía administrativa y facultades.",0.00%,,,,,,,,,,,,,,0,,,,0,0,,,,0,
133,Municipios,"Debemos perfeccionar y ampliar los mecanismos de participación comunal, mejorando la legislación que establece los Consejos Comunales de Organizaciones de la Sociedad Civil, ",0.00%,,,,,,,,,,,,,,0,,,,0,0,,,,0,
134,Municipios,"Debemos perfeccionar y ampliar los mecanismos de participación comunal, (...) estableciendo como política pública los Fondos Concursables y presupuestos participativos.",0.00%,,,,,,,,,,,,,,0,,,,0,0,,,,0,
135,Municipios,"Debemos perfeccionar y ampliar los mecanismos de participación comunal, (...) ampliando el ámbito de acción de las Oficinas de Información y Reclamos",0.00%,,,,,,,,,,,,,,0,,,,0,0,,,,0,
136,Municipios,"Debemos perfeccionar y ampliar los mecanismos de participación comunal, (...) mejorando la regulación sobre consultas ciudadanas y plebiscitos.",0.00%,,,,,,,,,,,,,,0,,,,0,0,,,,0,
137,Municipios,"Debemos fortalecer el Concejo Municipal, entregándole mayores facultades, atribuciones y también responsabilidades y otorgarles a los concejales la responsabilidad de acompañar y monitorear una o más áreas del quehacer municipal con la obligación de rendir cuentas.",0.00%,,,,,,,,,,,,,,0,,,,0,0,,,,0,
138,Municipios,"Sobre la dotación y el estatuto jurídico de los funcionarios municipales se propone retomar el debate sobre el Art. 121 de la constitución que permite a los alcaldes descentralizar la gestión de personal de acuerdo a las particularidades de cada municipio, impulsando la norma legal que otorgue la facultad de revisar la estructura de plantas. La discusión sobre el Art. 121, debe incorporar la revisión de las normas laborales de los funcionarios municipales, con el debido resguardo de la carrera funcionaria y participación de todos los estamentos, permitiendo que éstos trabajen en condiciones de dignidad y de resguardo de sus derechos como trabajadores.",0.00%,,,,,,,,,,,,,,0,,,,0,0,,,,0,
139,Municipios,"Estudiar compensaciones, con cargo al presupuesto nacional, por las exenciones de diversos tributos de beneficio municipal, por ejemplo, por exención del pago de los derechos de aseo, del pago de contribuciones, o por la construcción de viviendas sociales, materias que gravan en mayor medida a los municipios más pobres del país",0.00%,,,,,,,,,,,,,,0,,,,0,0,,,,0,
140,Municipios,"Corregir, mediante una modificación a la Ley de Rentas Municipales, las discriminaciones e injusticias que existen, en particular para que los grandes contribuyentes financien adecuadamente las prestaciones y servicios que reciben de los municipios",0.00%,,,,,,,,,,,,,,0,,,,0,0,,,,0,
141,Municipios,Asegurar normativamente que cualquier nueva función o tarea que se le asigne a los municipios deberá contemplar el financiamiento respectivo.,0.00%,,,,,,,,,,,,,,0,,,,0,0,,,,0,
142,Pesca,"Complementariamente, es esencial modernizar el Servicio Nacional de Pesca (Sernapesca). El sub-reporte, la pesca ilegal, o simplemente la no fiscalización de los desembarques, contribuyen a la sobreexplotación. Contar con una institucionalidad fiscalizadora a la altura de los desafíos es también fundamental.",0.00%,,,,,,,,,,,,,,0,,,,0,0,,,,0,
143,Pesca,"Asimismo, consideraremos la veda biológica legal de pesquerías declaradas colapsadas, junto con la eliminación progresiva de la pesca de arrastre, mediante una transición que genere los mínimos impactos en la industria nacional.",0.00%,,,,,,,,,,,,,,0,,,,0,0,,,,0,
144,Pesca,"Por ello, impulsaremos el Instituto de Desarrollo de la Pesca Artesanal, con recursos y presencia regional, para que sea un motor de desarrollo social y económico de este sector.",45.00%,,9689-21,"Crea el Instituto Nacional de Desarrollo Sustentable de la Pesca Artesanal y de la Acuicultura de Pequeña Escala, INDESPA.",http://congresoabierto.cl/proyectos/9689-21,1,,,,,,,,,0.45,,,,0,0,,,1,1,"El proyecto crea el INDESPA con presencia en cada región y cuyo objeto será la facilitación del acceso al crédito, la asistencia técnica y capacitación a los beneficiarios en todo el país, el financiamiento de aportes no reembolsables, así como también aquellos destinados a atender situaciones de catástrofe."
145,Pesca,"Adicionalmente, asumimos el compromiso de concretar durante el próximo período presidencial la extensión de las 5 millas de protección artesanal desde Chiloé hasta el extremo sur, para que en todo el país exista una zona exclusiva para pescadores artesanales, y no se discrimine a los pescadores australes.",0.00%,,,,,,,,,,,,,,0,,,,0,0,,,,0,
146,Pesca,"En materia de seguridad social, realizaremos los esfuerzos necesarios para incorporar a los pescadores artesanales, tanto al sistema de pensiones, como a la salud laboral, participando de la ley de Accidentes del Trabajo y Enfermedades Profesionales.",0.00%,,,,,,,,,,,,,,,,,,0,0,,,,0,
147,Pesca,"En el ámbito de la pesca debemos velar por que los instrumentos legales cautelen los intereses y demandas de todos los sectores involucrados, con una preocupación especial por aquellos más vulnerables. Por esto, realizaremos una evaluación de la Ley de Pesca aprobada durante la actual administración.",0.00%,,,,,,,,,,,,,,0,,,,0,0,,,,0,
148,Protección Social,"En los primeros 100 días de Gobierno se enviará al Congreso un proyecto de ley que crea una AFP estatal, que permita mayor competencia de precios, la atención preferente de grupos de la población de menor interés para las AFP existentes, como los trabajadores independientes, de menores rentas y quienes laboran en zonas apartadas de los grandes centros urbanos;",46.57%,,9399-13,Crea una Administradora de Fondos de Pensiones del Estado.,http://congresoabierto.cl/proyectos/9399-13,1,,,,,,,,,0.45,3,,,3,0.0285714286,,,1,1,"El proyecto crea una AFP estatal con el objeto de aumentar la cobertura en materia de pensiones de los trabajadores de menores rentas, trabajadores independientes y trabajadores de zonas geográficas alejadas de centros urbanos, así como introducir mayor competencia en el Sistema de las AFP."
149,Protección Social,Fortaleceremos los mecanismos de ahorro previsional voluntario para generar una cobertura más amplia de la clase media y de menores ingresos.,0.00%,,,,,,,,,,,,,,0,,,,0,0,,,,0,
150,Protección Social,"En los primeros 100 días de Gobierno, enviaremos al Congreso, con discusión inmediata, el proyecto de ley del Aporte Familiar Permanente Marzo.",100.00%,,9273-05,Concede aporte familiar permanente de marzo y ajusta norma que indica.,http://congresoabierto.cl/proyectos/9273-05,,,,,,,,1,,1,,,2,2,0.0952380952,,,1,1,Se crea un aporte monetario familiar de carácter permanente para las familias de menores ingresos durante el mes de marzo.
151,Protección Social,Crearemos una nueva institucionalidad para la medición de la pobreza.,0.00%,,,,,,,,,,,,,,0,,,,0,0,,,,0,
152,Protección Social,"Adicionalmente, evaluaremos e implementaremos una normativa que permita hacer extensiva la asignación por muerte a la totalidad de los adultos mayores que tienen PBS y a los beneficiarios de APS con saldo cero en su cuenta individual.",0.00%,,,,,,,,,,,,,,0,,,,0,0,,,,0,
153,Protección Social,"Necesitamos agregar un nuevo componente al sistema de protección social, el Sistema Nacional de Cuidado, enfocado en servicios sociales en materia de cuidados. Ello incluye tanto la promoción de la autonomía de las personas mayores, así como el apoyo sistemático y continuo a quienes están en situación de dependencia.",0.00%,,,,,,,,,,,,,,0,,,,0,0,,,,0,
154,Pueblos Indígenas,"Tenemos por delante el desafío impostergable de reconocer constitucionalmente a los Pueblos Indígenas en el marco de la discusión de una Nueva Constitución para Chile, y debatir ahí un nuevo modo de convivencia como sociedad pluricultural.",0.00%,,,,,,,,,,,,,,0,,,,0,0,,,,0,
155,Pueblos Indígenas,éstos en los distintos niveles de toma de decisiones. Desarrollaremos un proceso de consulta con los Pueblos Indígenas para establecer reformas que generen espacios de autonomía y autodeterminación a nivel territorial mediante la generación de Estatutos Especiales de Autonomía.,0.00%,,,,,,,,,,,,,,0,,,,0,0,,,,0,
156,Pueblos Indígenas,"Por esto, en los primeros 100 días de Gobierno enviaremos un proyecto de ley con discusión inmediata, que confiere rango de Ministro de Asuntos Indígenas al Director de la Conadi.",0.00%,,,,,,,,,,,,,,0,,,,0,0,,,,0,
157,Pueblos Indígenas,"Para que tenga más fuerza esta institución se enviará al Congreso el proyecto de ley que crea el Ministerio de Asuntos Indígenas, que será además el encargado de colaborar con el Presidente de la República en la definición de una política indígena para Chile.",0.00%,,,,,,,,,,,,,,0,,,,0,0,,,,0,
158,Pueblos Indígenas,"Enviaremos el proyecto de ley que crea el Consejo de Pueblos Indígenas, autónomo y representativo de los diversos pueblos que existen en Chile.",0.00%,,,,,,,,,,,,,,0,,,,0,0,,,,0,
159,Pueblos Indígenas,"La Ley Antiterrorista será modificada para adecuarla a los estándares internacionales, tal como le han recomendado al Estado de Chile los órganos internacionales de protección de derechos humanos.",45.00%,,9692-07,Determina conductas terroristas y su penalidad y modifica los Códigos Penal y Procesal Penal.,http://congresoabierto.cl/proyectos/9692-07,1,,,,,,,,,0.45,,,,0,0,,,1,1,El proyecto modifica nuestra legislación antiterrorista tomando en cuenta las recomendaciones realizadas por los informes de las organizaciones internacionales sobre el tema.
160,Salud,"Vamos a desarrollar un Plan Nacional para la formación y retención de especialidades médicas para apoyar la formación de 4.000 nuevos especialistas y que incentive el ingreso de más de 5.000 médicos a los programas de formación, junto con articular una política moderna para el desarrollo del recurso humano médico especializado.",100.00%,,9865-11,Perfecciona normativa sobre profesionales y trabajadores del sector público de salud,http://congresoabierto.cl/proyectos/9865-11,,,,,,,,1,,1,,,2,2,0.0952380952,,,1,1,"El proyecto contempla medidas que constituyen incentivos que permitan atraer y retener a profesionales de la salud, especialmente médicos."
161,Salud,"convocaremos a un equipo de expertos con el mandato de redactar una propuesta de Proyecto de Ley de Isapres, que esté en el contexto del funcionamiento global del sistema de seguridad social en el ámbito de la salud.",0.00%,,,,,,,,,,,,,,0,,,,0,0,,,,0,
162,Salud,"Generaremos un Fondo Especial de Medicamentos de Alto Costo, que pueda responder a la demanda de nuestros beneficiarios, bajo protocolos y guías clínicas elaboradas por grupos de expertos.",45.00%,,9851-11,Crea un Sistema de Protección Financiera para Tratamientos de Alto costo y rinde homenaje póstumo a don Luis Ricarte Soto Gallegos,http://congresoabierto.cl/proyectos/9851-11,1,,,,,,,,,0.45,,,,0,0,,,1,1,El proyecto incorpora al Régimen General de Garantías en Salud el Sistema de Protección Financiera para Tratamientos de Alto Costo
163,Seguridad Ciudadana,"Promoveremos el derecho de los ciudadanos a vivir en ciudades o localidades más seguras. Esto implica fortalecer el rol de prevención social y situacional que los municipios ejercen, para lo que incorporaremos la seguridad ciudadana como un eje transversal y con preponderancia en el organigrama municipal.",67.62%,,9601-25,"Modifica la ley N° 18.695, orgánica constitucional de Municipalidades, y la ley N° 20.502, que crea el Ministerio del Interior y Seguridad Pública, permitiendo la creación de los consejos comunales y los planes comunales de seguridad pública",http://congresoabierto.cl/proyectos/9601-25,,,,1,,,,,,0.66,,,1,1,0.0476190476,,,1,1,"El proyecto busca fortalecer el rol Municipal en la seguridad pública, establecer un plan comunal de seguridad pública como instrumento de gestión comunal y la creación de los consejos comunales de seguridad pública."
164,Seguridad Ciudadana,Crearemos en la Subsecretaría de Prevención del Delito una Unidad Técnica de apoyo a los municipios.,0.00%,,,,,,,,,,,,,,0,,,,0,0,,,,0,
165,Seguridad Ciudadana,"Crearemos al interior de 150 comisarías del país las denominadas salas de familia, que serán atendidas por funcionarios llamados al servicio, de modo de no afectar el desvío de personal activo policial destinadas a la atención de casos de violencia intrafamiliar y temas de niños niñas y adolescentes como programa 24 horas.",0.00%,,,,,,,,,,,,,,0,,,,0,0,,,,0,
166,Seguridad Ciudadana,"Revisaremos la ley 20.000, entregando el conocimiento de las faltas consideradas en esta norma, ya no a la justicia penal, sino a los Juzgados de Policía Local.",0.00%,,,,,,,,,,,,,,0,,,,0,0,,,,0,
167,Seguridad Ciudadana,"Entregaremos a la potestad reglamentaria de ejecución, la determinación de los niveles o cuantía de droga que debe considerarse constitutiva de micro tráfico y, consecuentemente, aquella que le está permitido portar a una persona para su consumo personal inmediato en el tiempo.",0.00%,,,,,,,,,,,,,,0,,,,0,0,,,,0,
168,Seguridad Ciudadana,"Dotaremos de adecuado sustento institucional a los Tribunales de Tratamiento de Drogas, y extenderemos su competencia a diversos casos.",0.00%,,,,,,,,,,,,,,0,,,,0,0,,,,0,
169,Seguridad Ciudadana,"Revisaremos y mejoraremos los mecanismos legales de rendición de cuentas públicas previstos en las leyes orgánicas respectivas tanto de la gestión administrativa, presupuestaria y sustantiva del Ministerio Público y las policías.",0.00%,,,,,,,,,,,,,,0,,,,0,0,,,,0,
170,Seguridad Ciudadana,"Adicionalmente, revisaremos la Ley Orgánica del Ministerio Público y enviaremos un proyecto de ley al Congreso con el objetivo de flexibilizar su diseño, de manera de permitir un funcionamiento más eficaz de la institución en materia de persecución de los delitos, coordinación interinstitucional y estructura organizacional.",39.65%,13.30%,9608-07,Crea el cargo de Fiscal Especial de Alta Complejidad en el Ministerio Público.,http://congresoabierto.cl/proyectos/9608-07,1,,,,,,,,,0.45,,5,,5,0.119047619,1,,,0.15,"El proyecto crea la Fiscalía Especial de Alta Complejidad, dedicada a la investigación y persecución de cierto tipo de delitos cuya gravedad y significancia social requiere de una dedicación exclusiva y con personal especializado en la materia. Con esto también se pretende lograr una descongestión en el trabajo de las fiscalías locales. No realiza modificaciones a la Ley Orgánica del Ministerio Público."
170,,,,66.00%,8265-07,Fortalece el Ministerio Público,http://congresoabierto.cl/proyectos/8265-07,,,,1,,,,,,0.66,,,,0,0,,,1,1,"La indicación sustitutiva tiene por objeto el  fortalecimiento integral y modernización del Ministerio Público, potenciando tres áreas: 1) el desarrollo institucional; 2) la investigación y tramitación de causas menos complejas y complejas; 3) la atención de víctimas y testigos. "
